A1: Ranking | B1: School | C1: Average | D1: BW 04 | E1: US News2005 | F1: FinancialTimes 2005 | G1: Forbes2005 | H1: WSJ 05
A2: 1 | B2: Wharton | C2: =(D2+E2+F2+G2+H2)/5 -> 2.8 | D2: 3 | E2: 2 | F2: 1 | G2: 2 | H2: 6
A3: 2 | B3: Dartmouth | C3: =(D3+E3+F3+G3+H3)/5 -> 4.8 | D3: 10 | E3: 6 | F3: 6 | G3: 1 | H3: 1
A4: 3 | B4: Harvard | C4: =(D4+E4+F4+G4+H4)/5 -> 5.6 | D4: 5 | E4: 1 | F4: 1 | G4: 7 | H4: 14
A5: 4 | B5: Kellogg | C5: =(D5+E5+F5+G5+H5)/5 -> 5.6 | D5: 1 | E5: 4 | F5: 9 | G5: 10 | H5: 4
A6: 5 | B6: Stanford | C6: =(D6+E6+F6+G6+H6)/5 -> 6.2 | D6: 4 | E6: 2 | F6: 4 | G6: 6 | H6: 15
A7: 6 | B7: Chicago | C7: =(D7+E7+F7+G7+H7)/5 -> 6.2 | D7: 2 | E7: 8 | F7: 5 | G7: 3 | H7: 13
A8: 7 | B8: Columbia | C8: =(D8+E8+F8+G8+H8)/5 -> 6.4 | D8: 8 | E8: 9 | F8: 3 | G8: 4 | H8: 8
A9: 8 | B9: MIT | C9: =(D9+E9+F9+G9+H9)/5 -> 10.6 | D9: 9 | E9: 4 | F9: 10 | G9: 18 | H9: 12
A10: 9 | B10: Yale | C10: =(D10+E10+F10+G10+H10)/5 -> 10.8 | D10: 22 | E10: 15 | F10: 7 | G10: 5 | H10: 5
A11: 10 | B11: Berkeley | C11: =(D11+E11+F11+G11+H11)/5 -> 11 | D11: 17 | E11: 6 | F11: 10 | G11: 15 | H11: 7
A12: 11 | B12: Michigan | C12: =(D12+E12+F12+G12+H12)/5 -> 11.2 | D12: 6 | E12: 10 | F12: 12 | G12: 26 | H12: 2
A13: 12 | B13: Virginia | C13: =(D13+E13+F13+G13+H13)/5 -> 12 | D13: 12 | E13: 14 | F13: 15 | G13: 8 | H13: 11
A14: 13 | B14: NYU | C14: =(D14+E14+F14+G14+H14)/5 -> 12.4 | D14: 13 | E14: 13 | F14: 7 | G14: 13 | H14: 16
A15: 14 | B15: Cornell | C15: =(D15+E15+F15+G15+H15)/5 -> 13 | D15: 7 | E15: 15 | F15: 16 | G15: 9 | H15: 18
A16: 15 | B16: Duke | C16: =(D16+E16+F16+G16+H16)/5 -> 14.6 | D16: 11 | E16: 11 | F16: 14 | G16: 20 | H16: 17